80032 3/11/2011 3/13/2011

Shaw Issues Statement on Events in Japan
2011-03-13 22:00:05 UTC
BATON ROUGE, La.--(BUSINESS WIRE)--March 13, 2011--
The Shaw Group Inc. (NYSE: SHAW) issued the following statement regarding the recent events in Japan:
"On behalf of all Shaw employees around the world, I give our deepest sympathy to the people of Japan. This is an extraordinary tragedy, and we can only imagine how painful and challenging this time is for everyone in the country," said J.M. Bernhard Jr., Shaw's chairman, president and chief executive officer.
"To aid in the humanitarian efforts, Shaw has made a significant contribution to the American Red Cross, and I personally have directed all of our employees, including our team of nuclear experts, to stand ready to provide any assistance and support that we can to the government and people of Japan in responding to this terrible event.
"While it is premature to speculate on any impact the events in Japan may have on the U.S. nuclear industry, we continue to believe in the importance of nuclear energy and the role it will play in the future of our country, as well as the rest of the world. The new generation technology under construction today has been designed with greater safety systems in place that will even more effectively address the challenges we are seeing in Japan. The industry consistently incorporates operating experience and lessons learned and will continue to use those insights to make nuclear energy even safer.
"At this time, we do not believe there will be an impact on Shaw's nuclear projects currently under construction in the United States and China. Our customers have indicated they intend to move forward, and we believe the construction timelines will continue as planned," said Mr. Bernhard.


80032 3/11/2011 3/22/2011 
Shaw to Assist Toshiba in Providing Support Services at Fukushima Daiichi Nuclear Power Plant
2011-03-22 12:00:08 UTC
BATON ROUGE, La.--(BUSINESS WIRE)--March 22, 2011--
In response to the tragic events in Japan, The Shaw Group Inc. (NYSE: SHAW) will assist Toshiba Corporation in providing support services for the Fukushima Daiichi nuclear power station in Japan.
As an extension of the relationship the two companies have shared since 2006, Shaw will assist Toshiba with mitigation, remediation and recovery services at the plant. A team of experts from Shaw's Power and Environmental & Infrastructure Groups has mobilized to provide services both on the ground in Japan, as well as engineering, analysis, assessment and design from the U.S.
"The people of Japan have experienced an extraordinary tragedy. It is our hope that Shaw's nuclear, remediation and emergency response expertise will assist in bringing prompt resolution and relief to the situation at the Fukushima Daiichi nuclear power station," said J.M. Bernhard Jr., Shaw's chairman, president and chief executive officer. "Our relationship with Toshiba spans the globe. We are ready to help our partners and friends in their response to the events that resulted from this unprecedented natural disaster."
Shaw has extensive experience in nuclear, environmental and natural disaster services. In the aftermath of some of the largest disasters in recent history, Shaw rapidly and effectively mobilized its workforce to provide support following the events at Three Mile Island and Chernobyl nuclear power plants, hurricanes Katrina, Rita and Wilma and earthquakes in Haiti, Northridge, Calif., and Sumatra.


18091 3/11/2011 3/15/2011 
Curtiss-Wright Issues Statement on Its Nuclear Power Generation Business Following Recent Events in Japan
2011-03-15 20:52:50 UTC
Curtiss-Wright Issues Statement on Its Nuclear Power Generation Business Following Recent Events in Japan
PARSIPPANY, N.J., March 15, 2011 (GLOBE NEWSWIRE) -- Curtiss-Wright Corporation (NYSE:CW) today issued the following statement regarding its nuclear power generation business in light of the recent earthquake and tsunami in Japan and the ensuing damage to the Fukushima reactors:
"Our thoughts and prayers go out to the people of Japan in the face of this extraordinary natural disaster and the inconceivable hardships they are enduring," said Martin R. Benante, CEO and Chairman of Curtiss-Wright Corporation. "While we don't have any plant control equipment at the affected plants, with our long experience and acquired knowledge of the nuclear power generation market, we have been and will continue to work with U.S. and international nuclear regulatory agencies to provide information and assistance to Japan in any way that we can. We would anticipate that the lessons learned from this event will be incorporated into the design and operation of future nuclear power plants worldwide."
Mr. Benante continued, "According to some of the larger reactor designers and construction firms in the nuclear industry, the events in Japan are not expected to have any immediate impact on new nuclear projects currently under construction in the U.S. and China, two key markets for Curtiss-Wright where we are currently manufacturing reactor coolant pumps for Generation III+ commercial nuclear power plants. Throughout our history, we have developed numerous advanced technologies for the global nuclear market and we are proud to be a significant equipment supplier in building the safest and most advanced nuclear power plants in the world. Nuclear energy has been and will continue to be a key element in meeting the world's energy needs."
For over 50 years, Curtiss-Wright has been serving the nuclear power market, including the first U.S. nuclear power plant built at Shippingport, PA, and the first nuclear submarine for the U.S. Navy. Over the years, we have positioned the company to be a leader in critical nuclear technologies through investment in advanced product design and development.


24010 3/11/2011 3/14/2011 
Entergy Statement Regarding Recent Events in Japan
2011-03-14 20:36:14 UTC
NEW ORLEANS, March 14, 2011 /PRNewswire/ -- Entergy Corporation (NYSE: ETR) and its employees express their deepest sympathies to the people of Japan during this difficult time. Entergy's nuclear employees are closely monitoring the situation in coordination with the U.S. Nuclear Regulatory Commission, the Nuclear Energy Institute, the Institute of Nuclear Power Operations and industry peers. Working through NEI, we have offered our support and assistance to the Japanese nuclear industry.
Entergy's nuclear plants were designed and built to withstand the effects of natural disasters, including earthquakes and catastrophic flooding. The NRC requires that safety-significant structures, systems and components be designed to take into account the most severe natural phenomena historically reported for each site and surrounding area. In determining the appropriate standards, the NRC includes an added safety margin to ensure that the standards take into account the risk that a future event, such as an earthquake or flooding, could be more severe than any recorded historical event. Systems are designed with multiple contingent backup systems to provide greater safety margins.
In addition to stringent design and construction standards, Entergy and other nuclear operators conduct ongoing programs to ensure plant safety. These programs, which are closely monitored and evaluated by the NRC, include:
-- Ongoing risk analysis and design enhancements to address natural and man-made risks. -- Extensive operator training in preparation for extreme conditions, along with drills and evaluations by the NRC. -- The development and implementation of emergency response plans aimed at protecting public health and safety (such as those put in place following Hurricane Katrina); these plans are regularly exercised in cooperation with local, state and federal agencies.
There will be lessons learned from this tragic event. Incorporating those lessons into operating experience is a hallmark of the global nuclear industry. It is worth noting that the natural environment surrounding the nuclear plants in Japan is very different from the environment surrounding Entergy's nuclear plants. According to information provided to us by NEI, and generally common knowledge in the scientific community, Japan is more susceptible to frequent and intense earthquakes than other developed countries. While it is still early, it appears that the nuclear units' safety systems functioned properly after the initial effects of the earthquake in Japan. Reports suggest it was the overwhelming tsunami that severely damaged the plant's cooling capabilities and recovery efforts.
Risk management is an ongoing practice at Entergy, including mitigating environmental, security, safety and mechanical risks, to name a few. The company understands and appreciates that these forces, natural and man-made, require constant vigilance and preparation for the unexpected. Accordingly, the company will continue to monitor closely the situation in Japan, and lessons will be learned and translated to even greater safety and effectiveness to meet the challenges of the most adverse and unexpected events, creating stronger public confidence in U.S. nuclear programs.
More information on the nuclear industry and events in Japan can be found at www.nei.org.


15720 3/11/2011 3/11/2011
Southern California Edison's San Onofre Nuclear Generating Station Operating Safely Following Tsunami Advisories
2011-03-11 20:51:03 UTC
ROSEMEAD, Calif.--(BUSINESS WIRE)--March 11, 2011--
Southern California Edison's (SCE) San Onofre Nuclear Generating Station is operating safely following a tsunami advisory issued early this morning for the Orange County coastline by the National Oceanic and Atmospheric Administration. SCE's operations system-wide continue to function, and there have been no reports of any unusual activity.
The tsunami advisory came following an 8.9 magnitude earthquake that struck Japan Thursday. The National Weather Service reports the tsunami could send waves one to three feet high along the West Coast today.
The San Onofre Generating Station has not reported any unusual activity. All operations continue normally. The plant's protective measures include a reinforced wall 30 feet above sea level.
As a precautionary measure, SCE personnel have been placed on standby in coastal areas that may be affected. Additional personnel will be dispatched to any areas if needed.
SCE also wants to reinforce safety warnings to customers. In the event of any power outages and power lines are on the ground, do not touch them. Stay away and call 911 immediately.


57904 3/11/2011 3/11/2011
Aflac Pledges 100 Million Yen to Red Cross Disaster Relief for Japan
2011-03-11 14:59:20 UTC
COLUMBUS, Ga., March 11, 2011 /PRNewswire/ -- Aflac has pledged 100 million yen to the International Red Cross to assist with their disaster relief efforts in Japan. Aflac is the largest insurer in Japan based on policies in force.
"Our thoughts and prayers go out to the Japanese people during this very difficult time," Aflac Chairman and CEO Dan Amos said. "We stand ready to assist in the healing process and are pledging these funds to ensure that basic needs are cared for during this crisis."
Aflac will work with the International Red Cross to expedite this contribution.


57904 3/11/2011 3/14/2011 
Aflac Japan Corporate Offices Fully Operational, Employees Sustained No Injuries, Expected Impact on Japan Sales Minimal; Aflac Incorporated Affirms 2011 Operating EPS Target
2011-03-14 12:00:44 UTC
COLUMBUS, Ga., March 14, 2011 /PRNewswire/ -- Aflac Incorporated today announced that its operations in Japan are up and running and ready to assist policyholders following the recent earthquake in the Tohoku area, which includes the cities of Sendai and Minami Sanriku. Aflac Japan's main offices, including the corporate offices in Tokyo and operational centers in both Tokyo and Osaka, are undamaged and fully functional.
Aflac Japan's employees are safe, and the company continues to reach out to their independent sales force to assess their needs. The Aflac leadership teams from both the U.S. and Japan remain in close contact.
While the hardest-hit areas were Iwate, Miyagi and Fukushima prefectures, less than 5% of Aflac Japan's new sales and in-force premiums are derived from these prefectures. Only two of Aflac Japan's 82 sales offices have been negatively impacted; these two offices, located in a single building in Sendai, have minimal damage, but will be closed temporarily due to power outages.
About this natural disaster, Aflac Japan President and Chief Operating Officer Tohru Tonoike commented: "First and foremost, our thoughts go out to all those affected here in Japan. We are very grateful none of our employees were injured. We are working with our sales force to ensure that we provide them with assistance and help them take care of our customers. We remain ready to respond to the needs of our policyholders by paying claims swiftly, and will prioritize our response to those in the affected areas. We successfully executed our disaster preparedness plan and as a result, our operations stand ready to serve our policyholders and claimants."
Aflac Incorporated Chairman and CEO Daniel P. Amos added: "In addition to sending our thoughts and prayers to each and every Japanese citizen, we want all of our Aflac Japan employees, sales agents and policyholders to know that your Aflac family here in the U.S. sends our support in every way possible. On Friday, we made an initial donation of 100 million yen to the International Red Cross to help with the start of the relief effort. Additionally, funds have been established by both our U.S. and Japanese employees and sales forces for our friends in Japan, including fellow employees and sales associates that have been most impacted by the disaster. Most importantly, we want our policyholders to know that we are here to deliver on our promise -- we will be there when they need us most. Having operated in Japan for almost four decades, we know Japanese citizens are incredibly resilient and we want to help in any way possible as they work through this difficult time.
"As we look to the remainder of 2011, we expect Aflac Japan sales will only be minimally impacted by these events. Our earnings guidance for the year remains unchanged: we will likely be at the low end of the 8% to 12% range for operating earnings per diluted share growth in 2011, excluding the impact of currency."


21776 3/11/2011 3/14/2011 
Exelon Statement on Japan Disaster
2011-03-14 19:28:03 UTC
CHICAGO--(BUSINESS WIRE)--March 14, 2011--
Exelon is closely monitoring the situation in Japan as it continues to unfold. While there is still a great deal we don't know, from all information the company received so far, it appears that the damage to the Japanese plants was primarily related to the tsunami, not the earthquake.
Exelon Chairman and CEO John Rowe said, "The earthquake and tsunami in Japan are a national tragedy. The events at the Fukushima power plants are a source of grave concern. At Exelon, we are following the tireless efforts of the employees of the Tokyo Electric Power Company as closely as we can; our hearts are with these dedicated people. Meanwhile, we continue to learn all we can about these events.
"Our plants are safe, particularly given the different seismic patterns in our regions and the absence of tsunami-type events where we have operations. Still we watch, we learn, and we will work with the Nuclear Regulatory Commission and other policymakers, as well as industry colleagues, on what, if anything, should be done to apply what can be learned from this unprecedented situation," said Rowe.
All of Exelon's nuclear facilities are designed to American seismic and flood standards, reflecting their local geography. Exelon's nuclear plants are equipped with numerous and redundant safety systems designed to protect them against earthquakes, flooding and other natural disasters.
"Our plants are operating safely, and our plant neighbors are safe," said Rowe.
For information on what is occurring in Japan, visit the Nuclear Energy Institute's website: www.nei.org. This website is updated regularly and provides links to numerous other information sources.


21776 3/11/2011 3/16/2011 

Section 8 – Other Events.
Item 8.01. Other Events.
On March 16, 2011, Exelon Corporation (Exelon) and Exelon Generation Company, LLC (Generation) released a Fact Sheet summarizing the principal features and structures in Generation’s nuclear power plants that protect those plants from extreme environmental hazards, such as earthquakes and floods and summarizing some of the training and operating procedures that enable Generation to respond effectively to such events. A copy of the Fact Sheet is attached hereto as Exhibit 99.1.
Section 9 – Financial Statements and Exhibits.
Item 9.01. Financial Statements and Exhibits.
(d) Exhibits.
 
Exhibit No.	  	Description
99.1	  	Fact Sheet
* * * * *
This combined Form 8-K is being furnished separately by Exelon and Generation (Registrants). Information contained herein relating to any individual Registrant has been furnished by such Registrant on its own behalf. No Registrant makes any representation as to information relating to any other Registrant.
This Current Report includes forward-looking statements within the meaning of the Private Securities Litigation Reform Act of 1995 that are subject to risks and uncertainties. The factors that could cause actual results to differ materially from these forward-looking statements include those discussed herein as well as those discussed in (1) Exelon’s 2010 Annual Report on Form 10-K in (a) ITEM 1A. Risk Factors, (b) ITEM 7. Management’s Discussion and Analysis of Financial Condition and Results of Operations and (c) ITEM 8. Financial Statements and Supplementary Data: Note 18; and (2) other factors discussed in filings with the Securities and Exchange Commission by the Registrants. Readers are cautioned not to place undue reliance on these forward-looking statements, which apply only as of the date of this Current Report. None of the Registrants undertakes any obligation to publicly release any revision to its forward-looking statements to reflect events or circumstances after the date of this Current Report.

Fact Sheet
Exelon Plants are Well-Protected
From Floods, Earthquakes and Tsunamis
Exelon’s nuclear power plants are designed to withstand extreme environmental hazards, including floods and earthquakes.
 
The U.S. Nuclear Regulatory Commission (NRC) requires all nuclear plants to be able to withstand the most severe natural phenomena historically reported for each plant’s geographic area out to 200 miles.
 
The NRC requires all nuclear plant designs to include a substantial margin for safety by requiring the use of conservative criteria.
 
Exelon’s nuclear plants are designed to withstand substantial earthquakes even though none of our plants is in a significant earthquake zone.
 
 Depending on the location, Exelon plants are engineered to withstand earthquakes between 6.0 and 6.9 on the Richter scale at the plant site, which translates into larger earthquakes as measured at the epicenter.
 
 All of Exelon’s plants are designed to withstand substantial ground motion in an earthquake.
 
Every U.S. nuclear power plant performs in-depth seismic analyses and the NRC regularly reviews new information on earthquake sources and ground motion models. Regulations are modified accordingly.
 
All of Exelon’s plants – even the longest serving – are able to withstand and safely shut down in very strong earthquakes.
Tsunamis are not a threat to Exelon Nuclear plants.
 
All but one of Exelon’s 10 nuclear plants are located in Illinois and Pennsylvania.
 
Our Oyster Creek plant in New Jersey on Barnegat Bay is more than 5 miles inland from the Atlantic Ocean. Tsunami events are not typical on the East Coast.
 
Barrier islands five miles away would limit the energy of a tsunami prior to reaching the closest coastline to Oyster Creek.
 
In addition, Oyster Creek is elevated 23 feet above mean sea level.
 
 The maximum recorded high tide on the Barnegat Bay beachfront more than 5 miles away is 7 feet above mean sea level (1962).
 
 Oyster Creek’s elevation is greater than the probable maximum hurricane tidal surge.
Exelon plants are hardened against floods
 
Emergency core cooling systems are protected from water incursion, including water tight doors, elevation of equipment above potential flood levels and/or special engineered flood barriers.
 
Emergency diesel generator exhausts are elevated on roofs.
 
Main fuel tanks for emergency diesels are buried underground or enclosed in buildings to prevent impact from severe environments. They cannot float away.
 
Electrical switchgear for emergency operations at the plants is protected from floods by elevating them above potential flood levels or protecting them behind watertight doors.
All U.S. nuclear plants are based on a “defense-in-depth” design, which means multiple physical barriers and multiple backup safety systems ensure safe operations even in extreme environments.
Plant foundations, structures and equipment are designed to withstand severe ground motion and flooding.
 
Exelon’s Boiling Water Reactors have multiple systems to provide water to the reactor core in an emergency. Some of these systems are divided into independent subsystems that are powered by multiple redundant power sources.In effect, all Exelon plants have six or more ways to put water into the core in an emergency.
 
Exelon nuclear plants have systems and strategies that minimize hydrogen buildup in secondary containment, which we believe was the source of explosions at Fukushima Units 1 & 3.
All Exelon Nuclear plants are able to safely shut down and keep the fuel cooled even without electricity from the grid.
 
All Exelon nuclear plant systems get electricity from at least two independent power lines in the grid that feed into two independent power transformers.
 
In an offsite power loss, safe shutdown is ensured through multiple redundant systems specifically designed to maintain electric power when electricity is lost from the grid off site.
 
 Locomotive-sized emergency backup diesel generators at plants that start automatically if offsite power is lost. Each two-reactor site has five emergency generators; each one unit site has three (except Oyster Creek, which has two diesels and two gas combustion turbine generators).
 
 Battery banks to back up the emergency diesel generators.
 
Additional high-capacity generators or special equipment that back up each unit’s emergency diesel generators and battery banks.
 If a used fuel pool were to lose water – even in significant quantities — all Exelon Nuclear sites have portable, high-capacity pumps to ensure the pools remain filled.
 
Emergency water can be drawn using multiple methods from large water sources that include tanks of at least 100,000 gallons, large pools of water designed specifically to remove heat from the reactor core, cooling water lakes that frequently cover hundreds of acres, and rivers and other water sources near the plants
 
All Exelon plants have “Severe Accident Mitigation Guidelines.” The guidelines prescribe actions beyond normal emergency operating procedures and address severe challenges to the reactor core of the kind seen in Japan.
 
These systems are constantly tested, challenged or simulated to ensure proper operation when needed.
All U.S. nuclear plants undergo frequent scenario drills to ensure the proper function of the redundant safety protocols.
 
These drills are managed and overseen by the NRC with collaboration from plant operators and other federal and local emergency agencies, including FEMA.
Beyond the physical features, Exelon plants have conservative operating procedures that place nuclear and public safety above all other factors.
 

?


21776 3/11/2011 3/24/2011 
Item 8.01. Other Events.
On March 24, 2011, Exelon Corporation (Exelon) and Exelon Generation Company, LLC (Generation) will conduct a conference call with investors to present an update on the nuclear situation in Japan and the safety of Generation’s nuclear plants. The presentation slides to be discussed during the call are attached hereto as Exhibit 99.1.
Exelon has scheduled the conference call for 9:30 AM ET (8:30 AM CT) on March 24, 2011. The call-in number in the U.S. and Canada is 800-690-3108, and the international call-in number is 973-935-8753. If requested, the conference ID number is 54423498. Media representatives are invited to participate on a listen-only basis. The call will be web-cast and archived on Exelon’s Web site: www.exeloncorp.com. (Please select the Investors page.)
Telephone replays will be available two hours after the call ends through April 7, 2011. The U.S. and Canada call-in number for replays is 800-642-1687, and the international call-in number is 706-645-9291. The conference ID number is 54423498.


43449 3/11/2011 3/14/2011
McDonald's Contributes to Disaster Relief Efforts in Japan
2011-03-14 21:16:19 UTC
McDonald's Contributes to Disaster Relief Efforts in Japan
OAK BROOK, IL -- (MARKETWIRE) -- 03/14/11 --
McDonald's Corporation (NYSE: MCD) today announced that it will contribute to the Japan disaster relief efforts with a donation of $2 million USD. The funds will be channeled through the International Federation of the Red Cross.
"The devastation in Japan has stunned and saddened the global community, and we're reaching out to help with this contribution," said Jim Skinner, McDonald's Chief Executive Officer. "We send our best to everyone affected by this disaster, including our employees and our customers."
McDonald's has 3,302 restaurants in Japan. As of this date, the vast majority of the restaurants are open; fewer than 300 remain closed due to damage or staffing issues.


85627 3/11/2011 3/17/2011 
Sonic Automotive, Inc. Discusses Import Brands
2011-03-17 12:51:31 UTC
CHARLOTTE, N.C., March 17, 2011 /PRNewswire/ -- Sonic Automotive, Inc. (NYSE: SAH), one of the nation's largest automotive retailers, wishes to express its sympathy to all of the families of its manufacturer partners affected by the recent natural disaster in Japan. Sonic Automotive is proud of its long history with the Japanese import brands.
Jeff Dyke, Sonic's Executive VP of Retail Operations, stated, "Our thoughts and prayers are with all those families affected by this unprecedented natural disaster."
Commenting on the impact on Sonic Automotive, "We await further news as these companies continue to evaluate the impact of these events on their supply chain and manufacturing capacity. Between inventory we have on the ground and what is available from the manufacturers, we believe we have adequate inventory based on the information that we have. Our used vehicle buying organization is prepared to supplement our new vehicle inventory with quality nearly-new used vehicles should the manufacturing disruptions interrupt new vehicle inventory supplies longer than currently anticipated. We don't expect any disruption to our business over the remainder of the first quarter and into the early second quarter."


23473 10/29/2012 11/27/2012 
Cincinnati Financial Corporation Announces Preliminary Estimate for October Storm Losses
Cincinnati, November 27, 2012 – Cincinnati Financial Corporation (Nasdaq: CINF) today announced that The Cincinnati Insurance Companies’ property casualty group expects its fourth-quarter results to include pre-tax catastrophe losses of approximately $25 million to $35 million from Superstorm Sandy, with its commercial lines insurance segment accounting for approximately two-thirds of that total. Catastrophe losses from storm damage affect property casualty insurance underwriting income, one of the sources of consolidated net income along with profits from investment operations and life insurance operations.
Approximately 60 percent of the group’s claims from Sandy occurred in the Cleveland, Ohio area and another 20 percent occurred in the state of Pennsylvania. Most of the claims stemmed from wind damage or from water damage due to drain back-ups, hydrostatic pressure or roofs that leaked after unusually heavy rain.
Steven J. Johnston, president and chief executive officer, commented, “Our hearts go out to those who lost loved ones, suffered injuries or had their lives turned upside down. Their losses are immeasurable.
“The estimate we have provided for our Sandy losses is preliminary. If we experience no additional effect from storm losses during the fourth quarter of 2012, the effect of these catastrophe losses on our combined ratio for the quarter would be approximately three times higher than our historical 10-year average of 1.1 percentage points for the fourth quarter, based on estimated property casualty earned premiums.
“The capital strength and liquidity of Cincinnati Insurance continue to benefit our independent agents and policyholders, giving us exceptional ability to absorb storm losses while providing the highest quality service for claims involving storms or other insured loss events.”


59459 10/29/2012 11/6/2012 
Travelers Commits $800,000 to Assist in Storm Sandy Relief Efforts
2012-11-06 21:30:00 UTC
NEW YORK--(BUSINESS WIRE)--November 06, 2012--
The Travelers Companies, Inc. (NYSE: TRV) today announced that the company will donate $800,000 to disaster relief efforts in the New York tri-state area in the aftermath of Storm Sandy.
Travelers will contribute $200,000 to each of the following organizations: the Mayor's Fund to Advance New York City, American Red Cross on Long Island, Hurricane Sandy New Jersey Relief Fund and the American Red Cross of Connecticut.
"In keeping with Travelers' tradition of supporting communities in times of need, we will make contributions to provide emergency services for victims of the storm," said Jay Fishman, Chairman and Chief Executive Officer of Travelers. "Our hearts go out to the millions of Americans impacted by this weather event, and we will continue to do our part to help people get through this difficult time."
In response to the storm, Travelers has more than 5,000 employees actively engaged in person or by phone to help customers and agents. Additionally, the company has five Mobile Claim Offices positioned in affected areas.
"We are committed to reaching impacted customers and helping them to begin the recovery process as quickly as possible," said Bob Brody, Executive Vice President of Claim Services at Travelers. "From beginning to end of the claim process, we stand ready to help provide resources and information during this challenging period."
Travelers' customers are encouraged to visit the emergency response and storm recovery sections of travelers.com for more information and to file a claim.


89575 10/29/2012 11/8/2012 
Recent Trends and Events
For the quarter ended September 30, 2012, loss and loss adjustment expenses incurred decreased by $5,100, or 4.6%, to $106,445 from $111,545 for the comparable 2011 period.  The decrease was primarily due to pre-tax catastrophic weather event losses incurred of $2,355 during the quarter ended September 30, 2012 compared to $12,375 during the comparable 2011 period.
 We filed and were approved for a Massachusetts homeowners rate increase of 6.9% and a Massachusetts personal umbrella rate increase of 2.1%, both of which were effective September 15, 2012.
We filed and were approved for a New Hampshire automobile rate increase of 6.1%, which was effective July 15, 2012 and a New Hampshire homeowners rate increase of 5.1% which was effective September 15, 2012.
Our catastrophic weather event losses will be impacted by Hurricane Sandy which caused widespread damage in the Northeastern United States on October 29 and 30, 2012.  Our exposure to property and casualty losses is limited to the two states in which we write business, Massachusetts and New Hampshire.  We are currently assessing the impact of Hurricane Sandy on our business but do not believe at this time that it will have a material impact on our consolidated financial position.
?


68292 10/29/2012 11/28/2012
Selective Insurance Group Announces Hurricane Sandy Storm Losses
Branchville, NJ – November 28, 2012 – Selective Insurance Group, Inc. (NASDAQ: SIGI) today announced a preliminary pre-tax gross Hurricane Sandy loss of between $100 to $120 million and a pre-tax net loss of approximately $52 million, including reinstatement premiums and reinsurance recoveries. About two-thirds of the claims are in personal lines with the remaining in commercial lines. One area of uncertainty remains business interruption claims, which are included in the estimates but are still developing as some businesses are not back to full operation.
Selective is the sixth largest writer for the National Flood Insurance Program and expects record claim activity this quarter that will generate estimated, pre-tax, claim service revenue of $12 million, which will partially offset the $52 million loss. Together, these items will impact the fourth quarter statutory combined ratio by approximately 10 points and add an anticipated 2 points to our previous 2012 full-year guidance for the statutory and GAAP combined ratios.
“Industry models have estimated Hurricane Sandy insured losses to be in a wide range of $10 to $25 billion” said Chairman, President and Chief Executive Officer Gregory E. Murphy. “The storm made landfall in our top market share state of New Jersey making this a significant but manageable event for Selective.
 
“We prepared for the storm as we always do and have had Claims team members working around-the-clock since the day of the storm to assist our customers,” continued Murphy. “We are committed to resolving claims quickly and fairly to help our customers get their lives back in order.”
 


59192 10/29/2012 10/31/2012 
d) Subsequent event
In late October 2012, superstorm Sandy made landfall in the United States.  Given its recent occurrence and the limited information available, we cannot estimate at this time the amount of any possible losses from this event. The impact of this event will be reflected in our fourth quarter 2012 results.

In late October 2012, superstorm Sandy made landfall in the United States.  Given its recent occurrence and the limited information available, we cannot estimate at this time the amount of any possible losses from this event. The impact of this event will be reflected in our fourth quarter 2012 results.

59192 10/29/2012 11/8/2012
Chubb Establishes $1,000,000 Fund for Sandy Disaster Relief Efforts
2012-11-08 21:04:20 UTC
WARREN, N.J., Nov. 8, 2012 /PRNewswire/ -- The Chubb Corporation (NYSE: CB) has established a $1,000,000 fund for disaster relief efforts related to Hurricane/Tropical Storm Sandy.
Chubb will contribute $500,000 to the American Red Cross for disaster relief. In addition, the insurer will match employee contributions to qualified relief organizations on a two-for-one basis, up to $500,000. If total employee donations exceed $250,000, Chubb will continue to match those employee dollars on a dollar-for-dollar basis.
"We hope that our contributions will ease the suffering of Sandy victims and help them return to their normal lives as soon as possible," said John D. Finnegan, Chairman, President and Chief Executive Officer of The Chubb Corporation.


79323 8/25/2005 8/27/2005	
Hurricane Katrina Evacuations Underway; Important Evacuation Information
2005-08-27 21:39:00 UTC
NEW ORLEANS--(BUSINESS WIRE)--Aug. 27, 2005--With hurricane Katrina approaching it is important to listen to instructions from local authorities. If nearby homeowners have been evacuated, or you think evacuation may be a possibility, preparation now can help make the evacuation and potential recovery process easier on you and your family.
Before you leave... -- Collect all your important papers and documents. This includes banking, insurance, and financial information, as well as your bills and checkbook. -- Think carefully about what items are easily replaceable by insurance and what items are not, like family heirlooms, keepsakes, and pictures. -- If you don't have an up-to-date home inventory, walk through your home with a video or still camera. At the same time, make a list of what items you want to take, and have room to take, during an evacuation. -- If time allows, and civil authorities require you to evacuate, contact your Allstate agent for information on whether your homeowners policy provides coverage for living expenses while you're evacuated. and to answer any questions you may have about your insurance policies. If you leave... -- Always listen to and obey authorities if they advise you and your family to leave your home. -- Tell your neighbors where you will be going and exchange contact information. -- Inform your Allstate agent you have been evacuated. -- Respect law enforcement decisions on when you are allowed to return home.


79323 8/25/2005 8/30/2005 
If Your Home is Damaged or Destroyed... Important Hurricane Katrina Recovery Information
2005-08-30 16:16:00 UTC
NEW ORLEANS--(BUSINESS WIRE)--Aug. 30, 2005--Allstate Insurance Company customers whose homes or automobiles have been damaged or destroyed by hurricane Katrina can contact Allstate through The Good Hands Network by calling their Allstate agent, dialing 1-800-54-STORM, or logging on at Allstate.com.
10 Tips For Storm Recovery... -- Make sure your home is structurally safe. Be extremely careful inside your home. Debris may be hazardous and the potential for collapse may exist. If you're told by authorities to stay out, stay out. -- Make temporary repairs to prevent further damage, keeping receipts for materials. Call your Allstate agent and get advice about what to do next. -- If your home is unlivable, find out what living expenses your insurance policy may provide. -- Be patient and assist claims adjusters assigned to your case. Small losses may be settled quickly; extensive claims will take longer. -- Notify creditors if bills have been lost or you're unable to pay. -- Ask your utility company to stop billing if your home is unlivable or has been destroyed. -- Report your claim to Allstate promptly. Be aware, if a widespread disaster has occurred, the company may set up special procedures. -- Prepare to file an insurance claim by gathering all relevant policy numbers. -- Inventory your home for damaged or lost items before your adjustor arrives. This will speed up your claim process. -- Work with a qualified tax expert to find out about tax breaks you may be eligible for because of your losses.



79323 8/25/2005 9/1/2005
The Allstate Foundation Establishes $1 Million Hurricane Recovery Fund; In Addition, Company Matching Employee-Agent Donations Dollar-for-Dollar
2005-09-01 21:05:00 UTC
NORTHBROOK, Ill.--(BUSINESS WIRE)--Sept. 1, 2005--The Allstate Foundation is establishing a $1 million "Hurricane Recovery Fund" to aid the thousands of Hurricane Katrina victims. Foundation funds will be administered by organizations in the affected areas.
Also, The Allstate Corporation's 2005 Giving Campaign now is accepting donations for The American Red Cross Hurricane Katrina Relief Fund from Allstate's more than 70,000 employees, agents and agency staff. The company will match these donations on a dollar-for-dollar basis with no upward limit.
"Speaking from experience, we recognize the difficulties communities face after a catastrophe," said Edward M. Liddy, chairman and CEO, The Allstate Corporation. "The victims of Hurricane Katrina have experienced unimaginable hardships and we want to do our part to help them. Contributions from the Hurricane Recovery Fund will allow The Allstate Foundation to assist those affected by Katrina to prepare for a new tomorrow."
"The Allstate Foundation Hurricane Recovery Fund" will support a variety of recovery efforts in affected communities. Specific needs may include: emergency shelter, food and clothing, health issues (as a direct result of the hurricane), social services, mental health recovery efforts, community clean up, rebuilding and restoring community emergency services, and assistance with home re-construction resident permit processing.



79323 8/25/2005 9/2/2005 

Allstate Offers Additional Relief to Customers via Deferred Payment; Companies to Defer Required Payments for Hurricane Katrina Victims in Affected Counties and Parishes of Louisiana, Alabama and Mississippi
2005-09-02 21:20:00 UTC
NORTHBROOK, Ill.--(BUSINESS WIRE)--Sept. 2, 2005--Companies within the Allstate family announced today that, effective August 26, 2005, they have implemented up to a 90-day deferred payment period for customers located in counties and parishes directly affected by Hurricane Katrina in Alabama, Mississippi and Louisiana.
Deferred payment means that customers who are unable to make their premium payments will not be penalized with a loss of coverage during the deferment period. If a customer continues to make payments, even if it's not the minimum amount due, their payments will be credited toward the outstanding premium amount. If a customer has a renewal policy offer pending during this timeframe, but is unable to make a payment, their policy will continue to be in effect. Additionally, installment fees will be waived during this timeframe.
Customers who are currently enrolled in the Easy Pay Plan, Mortgagee Pay or Payroll Deduction programs will not automatically be placed on a deferred payment schedule. If, however, funds are scheduled for removal from a customer's account in the impacted areas and no funds are available, the customer will be removed from the program(s) and rolled over to the deferred payment schedule.
If a customer would like to make a payment and cannot mail it in, credit/debit card and check payments can be made by calling 1-800-Allstate or visiting the Customer Care Center online at www.allstate.com. Customers with questions about the deferred payment policy may also call the customer service phone number listed on their policy or statements.
Counties and parishes currently impacted by this decision include areas of Baldwin and Mobile counties in Alabama; areas of Jefferson, Orleans, Plaquemines, St. Charles, St. Bernard, St. Tammany, Tangipahoa and Washington Parishes in Louisiana; areas of Clarke, Copiah, Covington, Forrest, George, Greene, Hancock, Harrison, Hinds, Jackson, Jasper, Jefferson Davis, Jones, Lamar, Lauderdale, Lawrence, Leake, Lee, Leflore, Lincoln, Marion, Newton, Pearl River, Perry, Pike, Rankin, Scott, Simpson, Smith, Stone, Walthall, Warren, Washington and Wayne counties in Mississippi.
During the initial 90-day period and beyond, Allstate will continue to work with officials in each state to monitor the situation and adjust the impacted areas as warranted.
Companies within the Allstate family include: Allstate Insurance Company, Allstate Motor Club, Allstate Life Insurance Company, Allstate Workplace Division (AWD), Lincoln Benefit Life Company, Surety Life Insurance Company, Encompass Insurance Company and Deerbrook Insurance Company.
Allstate Workplace Division is the marketing name for American Heritage Life Insurance Company (a wholly owned subsidiary of The Allstate Corporation). Products are underwritten by American Heritage Life Insurance Company. (C) 2005 American Heritage Life Insurance Company, Jacksonville FL.
79323 8/25/2005 9/3/2005 
Allstate `Kicks In' Support for Hurricane Katrina Relief; Allstate `Good Hands' College Field Goal Net Program Makes Donations to the American Red Cross Hurricane Katrina Relief Fund
2005-09-03 14:38:00 UTC
NORTHBROOK, Ill.--(BUSINESS WIRE)--Sept. 3, 2005--In conjunction with Allstate Insurance Company's new "Good Hands" field goal net program launched earlier this week, Allstate will make a $1,000 donation to the American Red Cross Hurricane Katrina Relief Fund for every successful field goal made by Allstate participating schools at their home and away games throughout the 2005 college football season. Allstate announced this week that its well-known "Good Hands" logo will be featured on the goalpost netting of more than 30 Division 1-A college football stadiums and seen by television viewers across the country.
Along with providing quality care to all customers in need, this program adds another commitment of support from Allstate for Hurricane Katrina relief. Allstate is matching all Allstate employee and Allstate agency donations to the American Red Cross Hurricane Katrina Relief Fund on a dollar for dollar basis. Additionally, The Allstate Foundation is establishing a $1 million Allstate Emergency Relief Fund to be administered by organizations in the impacted areas.
The Allstate "Good Hands" field goal net program will be launched in participating schools' stadiums this weekend as college football kicks off its 2005 season. At each participating university, Allstate will also make donations to the school's general scholarship fund for each field goal ($300 per) and extra point ($100 per) that travel through an Allstate branded net during their home games.
"In light of the recent Hurricane Katrina disaster that continues to devastate the Southeast, Allstate wanted to provide increased support in this time of need," said Joseph Tripodi, Allstate's chief marketing officer. "However, these monetary donations are just one part of our commitment to the communities in which members of the Allstate family live and work."
Schools participating in Allstate's "Good Hands" field goal net program in 2005 are:
-- Air Force -- Arizona State -- Army -- Baylor -- California -- Colorado -- Colorado State -- Florida State -- Fresno State -- Georgia Tech -- Houston -- Indiana -- Iowa -- Miami, Fla. -- Missouri -- New Mexico -- Northern Illinois -- Northwestern -- Oklahoma -- Pittsburgh -- Purdue -- Rutgers -- Southern Miss -- Syracuse -- UAB -- UCLA -- Utah -- Vanderbilt -- Virginia Tech -- Wake Forest -- Washington St.
?


79323 8/25/2005 9/14/2005 
Allstate and Tom Joyner Contribute to Hurricane Katrina Relief Fund
2005-09-14 17:35:00 UTC
NORTHBROOK, Ill.--(BUSINESS WIRE)--Sept. 14, 2005--Allstate today announced a relationship with The Tom Joyner Morning Show(R) to help families assisting those displaced by Hurricane Katrina. Allstate will match contributions to the BlackAmericaWeb.com Relief Fund up to the amount of $250,000.
The BlackAmericaWeb.com Relief Fund is providing support to households who are assisting those displaced by Hurricane Katrina. The money raised by the fund will go to individual families who have opened their homes to families displaced by Hurricane Katrina.
"With so many families in need as a result of the Hurricane, we are pleased to work with The Tom Joyner Morning Show(R) to match donations and expand the network of people receiving financial assistance," said Lisa Cochrane, vice president of integrated marketing communications, Allstate Insurance Company.
Donations are being solicited from The Tom Joyner Morning Show(R) listeners. The BlackAmericaWeb.com Relief Fund is working in cooperation with local churches in states neighboring affected areas to identify families in need of assistance.
For more information or to make a donation, log onto http://www.blackamericaweb.com.

79323 8/25/2005 9/2/2005 

Allstate Offers Additional Relief to Customers via Deferred Payment; Companies to Defer Required Payments for Hurricane Katrina Victims in Affected Counties and Parishes of Louisiana, Alabama and Mississippi
2005-09-02 21:20:00 UTC
NORTHBROOK, Ill.--(BUSINESS WIRE)--Sept. 2, 2005--Companies within the Allstate family announced today that, effective August 26, 2005, they have implemented up to a 90-day deferred payment period for customers located in counties and parishes directly affected by Hurricane Katrina in Alabama, Mississippi and Louisiana.
Deferred payment means that customers who are unable to make their premium payments will not be penalized with a loss of coverage during the deferment period. If a customer continues to make payments, even if it's not the minimum amount due, their payments will be credited toward the outstanding premium amount. If a customer has a renewal policy offer pending during this timeframe, but is unable to make a payment, their policy will continue to be in effect. Additionally, installment fees will be waived during this timeframe.
Customers who are currently enrolled in the Easy Pay Plan, Mortgagee Pay or Payroll Deduction programs will not automatically be placed on a deferred payment schedule. If, however, funds are scheduled for removal from a customer's account in the impacted areas and no funds are available, the customer will be removed from the program(s) and rolled over to the deferred payment schedule.
If a customer would like to make a payment and cannot mail it in, credit/debit card and check payments can be made by calling 1-800-Allstate or visiting the Customer Care Center online at www.allstate.com. Customers with questions about the deferred payment policy may also call the customer service phone number listed on their policy or statements.
Counties and parishes currently impacted by this decision include areas of Baldwin and Mobile counties in Alabama; areas of Jefferson, Orleans, Plaquemines, St. Charles, St. Bernard, St. Tammany, Tangipahoa and Washington Parishes in Louisiana; areas of Clarke, Copiah, Covington, Forrest, George, Greene, Hancock, Harrison, Hinds, Jackson, Jasper, Jefferson Davis, Jones, Lamar, Lauderdale, Lawrence, Leake, Lee, Leflore, Lincoln, Marion, Newton, Pearl River, Perry, Pike, Rankin, Scott, Simpson, Smith, Stone, Walthall, Warren, Washington and Wayne counties in Mississippi.
During the initial 90-day period and beyond, Allstate will continue to work with officials in each state to monitor the situation and adjust the impacted areas as warranted.
Companies within the Allstate family include: Allstate Insurance Company, Allstate Motor Club, Allstate Life Insurance Company, Allstate Workplace Division (AWD), Lincoln Benefit Life Company, Surety Life Insurance Company, Encompass Insurance Company and Deerbrook Insurance Company.
Allstate Workplace Division is the marketing name for American Heritage Life Insurance Company (a wholly owned subsidiary of The Allstate Corporation). Products are underwritten by American Heritage Life Insurance Company. (C) 2005 American Heritage Life Insurance Company, Jacksonville FL.

18403 8/25/2005 9/7/2005 
Hurricane Katrina
As of September 6, 2005, five of the Company's stores were closed as a result of Hurricane Katrina. The
closed stores represented approximately 0.5% of the Company’s total 2004 sales. The Company is in the
process of assessing the extent of the impact on these stores, and implementing action plans with respect to associates, merchandise allocation, and other business considerations, including reviewing property and business interruption coverage with its insurance carriers. Although the Company cannot provide an estimate of loss at this time, management does not currently anticipate that the direct effects of the hurricane on these stores will have a material effect on the Company's results of operations for the second half of fiscal 2005.


21020 8/25/2005 8/31/2005 
Get AAdvantage Miles for Support of American Red Cross Hurricane Relief Efforts
2005-08-31 22:17:00 UTC
FORT WORTH, Texas, Aug. 31 /PRNewswire-FirstCall/ -- American Airlines today announced a special reward of 500 AAdvantage bonus miles for anyone who donates a minimum of $50 to the American Red Cross Hurricane Relief Efforts.
"In this time of need, we wish to reward those who step forward to support the American Red Cross hurricane relief efforts," said Kurt Stache, President - AAdvantage Marketing. "The devastation and personal suffering brought about by this disaster impacts us all. Our prayers and sympathies go out to all those affected by this terrible event."
Program Details
American is offering its AAdvantage members a one-time reward of 500 AAdvantage bonus miles for donations of $50 or more to the American Red Cross between August 31 and September 30, 2005.
* You must be an AAdvantage member to receive the bonus miles. To enroll, visit http://www.aa.com/aadvantage . * Members will need to fax or mail their donation receipt to the AAdvantage Customer Service office. The AAdvantage account number of the member must be written on the receipt. * Fax number is: 817-963-7882. * Mailing address is: Hurricane Relief, American Airlines AAdvantage Department, P.O. Box 619688, DFW Airport, TX 75261-9688. Visit http://www.aa.com for more information on American's relief program. About American Airlines


21020 8/25/2005 9/3/2005 
American Airlines Flying Katrina Relief Missions Over Labor Day Weekend
2005-09-03 15:44:00 UTC
FORT WORTH, Texas, Sept. 3 /PRNewswire-FirstCall/ -- American Airlines dispatched three aircraft to New Orleans Saturday -- all of them manned by volunteer crews -- to pick up flood victims and fly them to Lackland Air Force Base in San Antonio, Texas.
American will fly similar missions Sunday, Monday and Tuesday. Each MD80 aircraft will make two trips each day for a total of 24 trips. More than 3,000 flood victims are expected to be flown out of the stricken city as a result of American's four-day operation.
Captain Al Madar, who oversees American's daily flight operations and is coordinating all of American's flying with the Federal Emergency Management Agency (FEMA), said everyone who works the flight is a volunteer.
"From the mechanic to the ramp worker to the pilots and flight attendants --- they are all volunteers," Madar said. "We've got a long list of American employees wanting to help in the effort."
American's airport manager in New Orleans, Tina Moman -- who was airlifted out of New Orleans on Tuesday when American flew the first rescue mission into the Louie Armstrong International Airport -- was on the first flight Saturday to oversee the ground operation there.


21020 8/25/2005 9/9/2005 
500 American Airlines Employee Volunteers at Reservation Center to Support National Hurricane Katrina Relief Telethon on Friday
2005-09-09 14:01:00 UTC
American Airlines Executives and Employees Raise Funds for Katrina Evacuees WHAT American Airlines employee volunteers will be answering calls from donors responding to Friday evening's national telethon, "Shelter from the Storm: A Concert for the Gulf Coast." The one-hour commercial-free telethon will be simulcast live from 7:00-8:00 p.m. CDT by ABC, CBS, NBC, FOX, the WB and UPN networks in addition to more than 30 cable affiliate channels. Proceeds will benefit the American Red Cross and Salvation Army. Media will have an opportunity to interview, photograph, and film American Airlines employee volunteers as well as Bella Goren, Vice President, Interactive Marketing and Reservations. In addition, other executives will be on-hand to lend their support during the telethon. WHEN Friday, September 9, 2005 5:30 p.m. American Airlines volunteers will begin arriving 5:45 p.m. Training begins at the Reservations center 6:00-11 p.m. American Airlines volunteers will answer pledge calls from across the nation WHERE American Airlines Southern Reservations Office 4700 American Boulevard, Fort Worth, Texas 76155 (Located near the CR Smith Museum at Highways 183 and 360) EVENT DETAILS/ACCOMMODATIONS FOR MEDIA Media are asked to arrive at 5:45 p.m. and may park in the employee parking lot and use the building's north entrance. BACKGROUND INFORMATION The telethon will feature leading entertainers from the film, television and music industry to raise money for Hurricane Katrina victims. To date, American Airlines employee response to this tragedy has been overwhelming. Beyond providing volunteer flight crews to staff relief flights into and out of hurricane-stricken areas, American Airlines, its employees and the American Airlines Credit Union have contributed almost $300,000 to relief funds benefiting the victims of Hurricane Katrina and have contributed clothing and other essential items to those affected by the storm and its aftermath.


21020 8/25/2005 9/14/2005 
American Airlines Federal Credit Union Supports Hurricane Katrina Relief Efforts
2005-09-14 21:37:00 UTC
FORT WORTH, Texas, Sept. 14 /PRNewswire-FirstCall/ -- Less than a week since a special account was developed to assist the American Red Cross with relief efforts for those directly affected by the devastation of Hurricane Katrina, AA Credit Union reached its pledge to match member donations to the Katrina Red Cross Fund up to a total of $100,000.
"Our hearts ache for the family, friends, Credit Union members and all fellow Americans directly impacted by the storm, winds and flooding, and they are in our prayers," said John Tippets, President and CEO, AA Credit Union. "And I could not be more proud of the overwhelming response of help from our members."
Contributions and pledges received to date have exceeded $236,000, including a $20,000 donation from the American Airlines Dallas/Fort Worth Recreation Committee. "The Credit Union strives to have a positive impact on the lives of all our members and their communities, and we are glad for the opportunity to focus, at this time, on those communities with the greatest of needs," said Tippets. "We are hopeful that our pledge of $100,000 will help us reach a total donation of $500,000 as the needs for those affected will continue to grow."
AA Credit Union is also assisting members by providing loan payment deferrals, by helping resolve issues related to loans on vehicles or homes that were damaged or lost, and by offering fee refunds (such as ATM surcharge fees, ATM/VISA(R) Check Card reorder fees, NSF fees, and traveler check fees).
In addition, in order to assist active employees living in the affected areas of Alabama, Mississippi, and Louisiana, AA Credit Union is facilitating the access of funds donated to the American Airlines/American Eagle Family Fund, a nonprofit charitable organization committed to providing emergency assistance to current or former employees and their families.


21020 8/25/2005 9/23/2005 
American Airlines Federal Credit Union Members/Owners Donate $400,000 to Support Hurricane Katrina Relief Efforts
2005-09-23 20:38:00 UTC
FORT WORTH, Texas, Sept. 23 /PRNewswire-FirstCall/ -- On Tuesday, September 20, John Tippets, President and CEO of American Airlines Federal Credit Union and David Campbell, AA Credit Union board member and Vice President Alliance and Kansas City Base Maintenance, American Airlines, presented a check for $400,000 to Robert P. McDonald, Chief Financial Officer of the American Red Cross. The donation was presented on behalf of AA Credit Union members-owners during the National Association of Federal Credit Unions (NAFCU) Congressional Caucus in Washington, D.C.
(Photo: http://www.newscom.com/cgi-bin/prnh/20050923/DAF022 )
"Credit Unions have a long standing history of helping their communities and supporting charitable activities," said Tippets, "And I could not be more proud of our member's quick and overwhelming response of help to these current, very critical needs." The $400,000 amount included member contributions and an AA Credit Union donation of $100,000.
Donations to the AA Credit Union's American Red Cross Hurricane Relief Efforts will be accepted throughout the remainder of the year.
How To Help
Members can make their donations via cash, check, or account transfer from their AA Credit Union account.
* By Phone: Call (800) 533-0035 and speak to a Member Service Representative for more information. * By Fax: Download the American Red Cross Donation Form from http://www.AACreditUnion.org and fax to: (817) 963-6108 or (800) 889-4480. * In Person: Visit any local AA Credit Union Branch to make a cash/check or account transfer donation. * By Mail: Make your check payable to "American Red Cross Fund" and mail to: AA Credit Union, P.O. Box 155489, Fort Worth, Texas 76155-0489


23297 8/25/2005 9/1/2005 
Brinker International Activates Hotline for Chili's and Romano's Macaroni Grill Employees in New Orleans Area, Southern Mississippi
2005-09-01 13:00:00 UTC
DALLAS, Sept. 1 /PRNewswire-FirstCall/ -- Brinker International (NYSE: EAT) has established a toll-free hotline for employees of its Chili's Grill & Bar and Romano's Macaroni Grill restaurants in areas of Louisiana and Mississippi affected by Hurricane Katrina. The hotline, (800) 717-2295, is staffed live from 8 a.m. to 5 p.m. CDT, Monday through Friday by operators who can answer employee questions and help direct them to available resources. Prerecorded information is also available 24 hours a day and voice mailboxes will be monitored after hours.


23297 8/25/2005 9/2/2005
Brinker International Updates Status of Restaurants in Louisiana, Mississippi
2005-09-02 12:00:00 UTC
DALLAS, Sept. 2 /PRNewswire-FirstCall/ -- A total of 14 Chili's Grill & Bar, Romano's Macaroni Grill and On The Border Mexican Grill & Cantina locations in Louisiana and Mississippi remain closed due to Hurricane Katrina, parent company Brinker International, Inc., today announced.
The restaurants closed include locations in Hammond, Harvey, La Place, Mandeville, Metairie, Slidell and Thibodaux, La.; as well as Biloxi, Gulfport, Hattiesburg and Jackson, Miss.
The company is in the process of assessing damage at all affected restaurants but anticipates reopening most of the locations when necessary repairs are complete, power and water are available and employees return to the area. The two Chili's locations in Metairie and Harvey will be closed indefinitely due to the prolonged evacuation of New Orleans and Jefferson Parish.
The 14 restaurants represent approximately 1 percent of annual revenues for Brinker. The company posted $3.9 billion in revenues for its recently completed 2005 fiscal year.
Brinker announced earlier that it has established a toll-free hotline for employees in areas affected by the hurricane. The hotline, (800) 717-2295, is staffed live from 8 a.m. to 5 p.m. CDT, Monday through Friday, by operators who can answer employee questions and help direct them to available resources. Prerecorded information is also available 24 hours a day, and voice mailboxes will be monitored after hours.
In addition, the company is mobilizing to provide food to evacuees at numerous shelters and coordinating with regional and national restaurant industry groups in support of broader relief efforts.


23660 8/25/2005 9/8/2005 
Cintas Provides Update on Impact Caused by Hurricane Katrina
2005-09-08 13:22:00 UTC
CINCINNATI, Sept. 8 /PRNewswire-FirstCall/ -- Cintas Corporation (Nasdaq: CTAS) continues to reach out to all its employees impacted by Hurricane Katrina. The Company has continued to pay its affected employees and will attempt to provide employment at a facility in any area where an employee has been relocated. The Company has also established a special phone number for its affected employees to call with any questions they may have. Scott D. Farmer, President and Chief Executive Officer stated, "Our most immediate concern is that our employees are safe, and we have requested that they contact the Company to tell us where they are located. We intend to do whatever we can to assist them in this terrible situation. Additionally, the Company is evaluating alternatives how it can best assist the region impacted by the storm."
Due to the impact of Hurricane Katrina and its aftermath, the Cintas operation in New Orleans, Louisiana has been shut down, and there currently is no estimate as to when operations can resume. The facility accounts for approximately $400,000 per week in revenues. While the facility appears to have sustained minimal property damage, it is difficult to determine, at this time, the financial impact on the Company due to the uncertain impact on Cintas' customers.
Additionally, the Company's operations in Mobile, Alabama; Jackson and Gulfport, Mississippi; Thibodaux, Baton Rouge and Hammond, Louisiana have all had disruptions in their utilities and were unable to operate most of last week. Power has now been restored and the operations are processing. However, business results may be impacted due to difficulties encountered by our customers in resuming their operations. The rapid increases in energy costs will also have a negative impact on the Company's margins if the current or higher price levels continue.
While it is difficult, at this time, to accurately determine the financial impact of the hurricane on Cintas, the Company expects to provide more specific information during its review of the first quarter operating results prior to the end of September.


23660 8/25/2005 9/21/2005 
Cintas Corporation Reports Growth in First Quarter Fiscal 2006
Revenue and Earnings
•   Total Revenue increases 10.4%
•   Earnings Per Share increases 11.9%
EVENUE AND EARNINGS GUIDANCE 
Mr. Farmer stated, “We are continuing to assess the impact of Hurricane Katrina on our operations. While damage to our facilities appears, at this point, to be minimal, the impact on our employee-partners and customers in the affected areas continues to be a major concern to the Company. We are assisting our employee-partners at our operations in New Orleans and Gulfport through salary continuation and other financial assistance. The ultimate cost of this assistance, combined with lower business volume at the affected operations, will have an impact on our results.”
Mr. Farmer continued, “Additionally, the rapid increase in the cost of energy could impact our results, unless such costs return to levels seen in our first quarter. All of these factors will impact our Fiscal 2006 results. Although it is too early to know the exact impact, we are reiterating our original revenue and earnings per share guidance for Fiscal 2006. That guidance is for revenue to be in the range of $3.35 billion to $3.45 billion with full year earnings per share (diluted) in the range of $1.95 to $2.05. However, at this point, our preliminary analysis of the impact of Hurricane Katrina, as well as higher energy costs, could move us to the low end of our earnings per share range. Despite this setback in the Gulf Coast region, our Company is very strong financially and Cintas partners are pulling together as is characteristic of our culture.”


49154 8/25/2005 9/6/2005 
Media Advisory: Target Hurricane Recovery Effort Update for Impacted Team Members and Guests
2005-09-06 23:03:00 UTC
MINNEAPOLIS, Sept. 6 /PRNewswire/ -- Target is committed to providing ongoing support for affected guests, team members and communities.
Target will waive fees, payments and finance charges for Target Visa card and Target Red card holders from the affected areas. Target credit card holders that live in the impacted areas are not required to make a minimum payment for September or October. In addition, during those two months, no finance charges will be assessed and no late fees will be charged. Target credit card holders should call toll-free 1-888-755-5856 for more information.
Target is also committed to helping impacted team members through this recovery process. Direct assistance to team members impacted by the hurricane is being provided through emergency funds, flexible payroll sites and crisis counseling. Target will guarantee positions for affected team members at any Target store nationwide.
Displaced Target team members are encouraged to contact Team Member Service Center (TMSC) at 1-800-394-1885, and press 7 for special hurricane help.
In addition to a previously announced $1.5 million donation to the American Red Cross, Target has provided the Red Cross with real estate in Louisiana so they can establish a central command center, and real estate in Seattle to be used as a training center. Target has also coordinated large-scale donations of essential products, including water, ice, coolers, diapers and baby wipes, and has provided supplies for military and local law enforcement support. Individual stores and distribution centers are also supporting shelters and local Red Cross agencies.
Guests and team members can visit http://www.Target.com to learn more about recovery efforts and assistance.


77606 8/25/2005 9/6/2005 
2005-09-06 14:13:00 UTC
MENOMONEE FALLS, Wis.--(BUSINESS WIRE)--Sept. 6, 2005--Just by making room in their closets for back-to-school and fall styles, consumers across the country can assist in relief efforts for those affected by Hurricane Katrina. From September 11-14, Kohl's (NYSE:KSS) stores nationwide will collect gently used clothes and shoes for Kids in Distressed Situations (K.I.D.S.), a national charity that delivers apparel items to disadvantaged children and their families. Clothing contributions will be used to assist in hurricane relief efforts.
Kohl's and K.I.D.S. have redirected the planned "Kohl's Clothes for Kids" event and now, all clothing donations will be directed towards hurricane relief. The four-day charity event, featuring collections at every Kohl's store in communities across the country, is an extension of an existing partnership between Kohl's and K.I.D.S. As an added incentive, every donor will receive a coupon worth an additional 15 percent off their next purchase at Kohl's through September 14.
Kohl's partnership with K.I.D.S. has resulted in numerous donations benefiting children and families across the country. Over the last three years, Kohl's has donated more than 2.6 million dollars worth of clothing to the organization.
"Our partnership with Kids in Distressed Situations is one more way Kohl's helps improve the lives of children in the communities we serve," said Julie Gardner, Kohl's senior vice president of marketing. "Our hearts go out to all the victims of this disaster, and we are pleased to partner with Kids in Distressed Situations to provide relief for children and families affected by this terrible storm. The need for assistance for Hurricane Katrina victims is tremendous, and we encourage Kohl's shoppers to participate in this event."
Kids in Distressed Situations, Inc. (K.I.D.S.) is a national charity of leading retailers, manufacturers and licensors of children's products, in partnership with major foundations, committed to helping children in need. K.I.D.S. encourages and facilitates donations of new apparel, shoes, toys, juvenile products, and other items that benefit children who are ill, living in poverty, or the victims of natural disasters. Since its founding in 1985, K.I.D.S. has donated more than $400 million worth of merchandise to children in need. For the past 20 years, two to four million children have benefited from K.I.D.S. programs each year.
"Although it is too early to know the full extent of the damage, Katrina's legacy will be felt for many years by the most vulnerable in this disaster, the children," said K.I.D.S. President, Dr. Janice Weinman. "Through the generosity of Kohl's and its customers, these contributions can make a critical difference."


10517 8/25/2005 8/31/2005
ATLANTA, Aug. 31 -- Aaron Rents, Inc. (NYSE: RNT), the nation's leader in the rental, sales and lease ownership, and specialty retailing of residential and office furniture, consumer electronics and home appliances and accessories, today stated that it is currently assessing the impact of Hurricane Katrina on
the operations of its stores in Louisiana, Mississippi, and Alabama. Preliminary reports indicate that the damage to these stores will be significant.
As of today, 20 Aaron's Sales & Lease Ownership stores are closed and 12 stores in Louisiana and Mississippi are either underwater or have significant water damage.
"Our foremost concern is the safety and well being of our employees and customers, as well as all of the citizens of the affected areas," said R. Charles Loudermilk, Sr. Chairman and Chief Executive Officer of Aaron Rents.
"The current difficulty in communicating to our employees and getting to many of the stores has made an accurate assessment of the damage impossible at this time. It could be weeks or months before the actual cost of the hurricane can be determined."
Aaron Rents currently has 46 stores in Louisiana, 25 stores in Mississippi, and 34 stores in Alabama. Of these stores, one store in Louisiana, five stores in Mississippi, and 16 stores in Alabama are franchised operations. The most severely effected stores at this time are eight Company- operated stores in the
New Orleans area and three Company-operated stores and a franchised store on the Mississippi coast. Based upon a very preliminary assessment, total property loss and business interruption expense for all of the stores affected by the hurricane could range from $5,000,000 to $10,000,000. This loss would include insured losses of merchandise, property, and other contents at store locations in addition to uninsured losses of merchandise in customer's homes. In addition, although not possible to accurately estimate at this time, a significant amount of ongoing business will be lost for a substantial period of time at the most seriously damaged stores. The current total average monthly revenue at the above-mentioned New Orleans and coastal Mississippi stores is approximately $1,100,000 per month.
"Our business was adversely impacted somewhat in the third quarter of last year by the three hurricanes in Florida," Mr. Loudermilk, Sr. continued. "However, those hurricanes did not have the significant widespread flooding and water damage these communities are experiencing from Katrina. Our history on past major hurricanes, such as Hurricane Andrew a number of years ago, is that our
business substantially picks up three to six months after the storm occurs as customers, many with the aid of government assistance, return to homes and need replacement furnishings."
The Company is designating $200,000 of funds in the Aaron's Community Outreach Program for assistance to Company employees affected by the hurricane and is also donating 50,000 cases of bottled water to the American Red Cross.

?


84084 8/25/2005 9/6/2005

HIBBETT ANNOUNCES INITIAL AFFECT OF HURRICANE KATRINA
 
BIRMINGHAM, Ala. (September 6, 2005) – Hibbett Sporting Goods, Inc. (NASDAQ/NM: HIBB), a rapidly growing sporting goods retailer, today announced that the Company lost a total of three stores due to Hurricane Katrina and will be assessing insurance claims related to those stores. One of these stores is expected to re-open within the next six to eight weeks. An additional seven stores are currently closed, six of which sustained minor damage and are expected to open shortly. In total, approximately 50 to 60 of Hibbett’s 508 stores have been affected by Hurricane Katrina to varying degrees with sales interruptions related to power outages in Alabama, Louisiana and Mississippi.
Mickey Newsome, Chairman and Chief Executive Officer, noted, "Our first priority during this time is certainly the health and safety of our associates and customers in these affected areas and their families. We have joined with relief agencies in the region to provide assistance to those families."
 


85913 8/25/2005 8/31/2005 
Marriott Update on Hurricane Katrina
2005-08-31 20:36:00 UTC
WASHINGTON, Aug. 31 /PRNewswire/ -- Marriott International, Inc. (NYSE: MAR) is working closely with authorities throughout the Gulf Coast region and other areas impacted by Hurricane Katrina. Marriott continues to provide for its guests and associates as best as conditions allow. The company has established a toll-free line for friends and families to call for information about guests and associates who may have been affected by the hurricane. That number is (866) 211-4610. (Outside the U.S. and Canada, the direct dial number is 402-390-3265.)
(Logo: http://www.newscom.com/cgi-bin/prnh/20030605/MARRIOTTLOGO )
Guests with reservations or plans to travel to either hurricane-impacted areas or nearby regions where evacuees are relocating are encouraged to call Marriott at (800) 559-9352 to determine hotel availability.
As of 2 p.m. (EDT) Wednesday, August 31, Marriott's 15 hotels in New Orleans have marginal operations and are unable to accept reservations. The affected properties include:
Courtyard New Orleans/Covington-Mandeville Courtyard New Orleans Downtown-Near the French Quarter Courtyard New Orleans-Convention Center Courtyard New Orleans-Metairie Fairfield Inn Kenner-New Orleans Airport JW Marriott New Orleans Marriott New Orleans Marriott New Orleans at the Convention Center Renaissance Arts Hotel Renaissance Pere Marquette Residence Inn New Orleans-Metairie Residence Inn New Orleans-Downtown SpringHill Suites New Orleans/Convention Center The Ritz-Carlton New Orleans and Maison Blanche TownePlace Suites New Orleans/Metairie
The above hotels will remain closed until local authorities advise they may reopen. In addition, the following hotels in affected areas remain temporarily closed:
Alabama The Grand Hotel Marriott Resort, Golf Club & Spa (Point Clear) Florida SpringHill Suites Pensacola
Marriott will provide updates on http://www.marriottnewsroom.com as information becomes available. For information regarding hotel reservations, please call (800) 228-9290. Those in countries outside of the United States seeking information about the impact of Hurricane Katrina should call the Marriott International toll-free number in their country.


85913 8/25/2005 9/2/2005 
Marriott Rewards(R) Allows Members to Redeem Points to Help Hurricane Victims
2005-09-02 20:01:00 UTC
WASHINGTON, Sept. 2 /PRNewswire/ -- Members of Marriott Rewards(R), Marriott International, Inc.'s (NYSE: MAR) guest loyalty program, who wish to help the victims of Hurricane Katrina can redeem points for Marriott Gift Cheques. The cheques can be used towards payment of hotel rooms or food at Marriott, JW Marriott, Renaissance, Residence Inn, Courtyard, SpringHill Suites, TownePlace Suites, Fairfield Inn hotels and Marriott Vacation Club International. The cheque will be sent to the member, who can then forward it to the American Red Cross. The Red Cross will distribute the cheques to victims needing assistance paying for hotel rooms and food.
The points can be redeemed by calling 1-801-468-4000 or 1-800-450-4442. $50 Marriott Gift Cheque 18,000 Marriott Rewards Points code 3571 $100 Marriott Gift Cheque 33,000 Marriott Rewards Points code 1941 $250 Marriott Gift Cheque 60,000 Marriott Rewards Points code 3581 $1000 Marriott Gift Cheque 180,000 Marriott Rewards Points code 1951 The cheques can be sent to the American Red Cross at: The American Red Cross Attn: Marriott Rewards Member Contribution 2025 E Street, NW Mail Stop NW7 -- 104C Washington, DC 20006 Please designate that the cheques be used for the Disaster Relief Fund.


85913 8/25/2005 9/2/2005 
Marriott Assists victims of Hurricane Katrina
2005-09-03 00:04:00 UTC
WASHINGTON, Sept. 2 /PRNewswire/ -- Marriott International, Inc. (NYSE: MAR) is working closely with authorities throughout the Gulf Coast region and other areas impacted by Hurricane Katrina.
"First and foremost, we extend our sympathies and support for everyone who has been personally and directly affected by this tragedy," said J.W. Marriott, Jr., chairman and CEO, Marriott International. "We recognize that the days and weeks ahead will be very difficult for all those impacted by Hurricane Katrina, including our more than 2,800 associates in the greater New Orleans area. We are thankful that Marriott was able to provide shelter and assist in the safe evacuation of over 1,700 guests and associates from our 15 New Orleans hotels."
Marriott is working closely with the appropriate authorities to determine how best to support relief efforts. As soon as we are given permission to enter the affected areas and our teams assess our hotels to provide for safety, the company plans to make designated hotels available for relief- related activities and personnel.
As we actively work to restore operations in all of our properties affected by the hurricane, we are just as focused on doing all we can to help our associates. Marriott has made arrangements to pay its associates through Sept. 30, 2005. In addition, we are setting up a leave sharing program so that fellow associates can donate paid time off to help those impacted by the storm.
Our guests are concerned and want to help too. We have developed a program that allows Marriott Rewards members to redeem points for Marriott Gift Cheques that the Red Cross can distribute to people impacted by this tragedy (for details visit: http://marriott.com/news/detail.mi?marrArticle=102037). A link on http://www.marriott.com has also been established to enable customers to contribute directly to the Red Cross Hurricane 2005 Relief Effort. Additionally, our associates across the country have been donating money to the American Red Cross Disaster Relief Fund and other agencies.
Due to the extraordinary circumstances, hotels in the Gulf Coast and
nearby regions are providing shelter for evacuees and relief workers. As a result, many of these hotels are now in a sold-out status and it may be difficult to accommodate new arrivals. Guests are encouraged to call Marriott at (800) 559-9352 to determine hotel availability. Efforts are also being made to contact customers with reservations to warn them of a severe shortage of space. Information on cancellation policies and the status of hotels impacted by the storm is available at http://www.marriottnewsroom.com. This list is updated as information becomes available.
Marriott has established a toll-free line for friends and families to call for information about guests and associates who may have been affected by the hurricane. That number is (866) 211-4610. (Outside the U.S. and Canada, the direct dial number is 402-390-3265.)


85913 8/25/2005 9/7/2005 
Marriott International and the Marriott Family Pledge a Total of $3 Million to Support Hurricane Katrina Relief
2005-09-07 22:01:00 UTC
WASHINGTON, Sept. 7 /PRNewswire/ -- Marriott International, Inc. (NYSE: MAR) and the Marriott family's private foundation, The J. Willard and Alice S. Marriott Foundation, have pledged a total of $3 million to aid employees and victims of Hurricane Katrina.
(Logo: http://www.newscom.com/cgi-bin/prnh/20030605/MARRIOTTLOGO )
"Hurricane Katrina has caused heartbreaking loss for the people of the Gulf Coast region, including our associates, their families and their communities," said J.W. "Bill" Marriott, Jr., chairman and CEO, Marriott International, Inc. "Our company and the Marriott family extend our deepest sympathy and concern to all those affected by this tragedy."
The company has contributed $500,000 to the American Red Cross to help all in the affected communities and has also established the Marriott & Ritz- Carlton Disaster Relief Fund under the auspices of the Community Foundation for the National Capital Region, a charitable organization, and made an initial $500,000 donation. This newly-established fund allows the company, associates, owners, franchisees, business partners, customers and others to financially assist Marriott & Ritz-Carlton managed and franchised associates affected by significant disasters in communities where we live and work.
The Marriott family foundation has made a challenge grant to match, dollar-for-dollar, all contributions to the Marriott & Ritz-Carlton Disaster Relief Fund received by March 1, 2006, up to a maximum of $1 million. The company's $500,000 contribution to this Fund is not included in the Foundation's challenge grant. Company associates, owners, franchisees, business partners, customers, guests or those wishing to double their own contributions toward associate assistance are invited to donate to the Marriott & Ritz-Carlton Disaster Relief Fund.
Separately, the Marriott family has pledged an additional $1 million toward longer-term disaster relief efforts, with the recipient organizations to be determined as the greatest needs are identified.
If you would like to contribute to the Marriott & Ritz-Carlton Disaster Relief Fund, you may do so by sending a check payable to:
Marriott & Ritz-Carlton Disaster Relief Fund The Community Foundation for the National Capital Region 1201 15th Street NW, Suite 420 Washington, D.C. 20005
For more information on the Marriott and Ritz-Carlton Disaster Relief Fund or to make a donation, please visit http://www.marriott.com.
*The Marriott & Ritz-Carlton Disaster Relief Fund is established under the Community Foundation for the National Capital Region, a public charity qualified under U.S. Internal Revenue Code Section 501(c)(3). Donations are tax deductible as charitable contributions to the extent allowed by applicable law.
59459 8/25/2005 8/26/2005 
St. Paul Travelers Catastrophe Team Responds to Hurricane Katrina, Prepares for Second Landfall
2005-08-26 21:33:00 UTC
HARTFORD, Conn.--(BUSINESS WIRE)--Aug. 26, 2005--St. Paul Travelers (NYSE:STA) and its member company First Floridian have mobilized their Catastrophe Response Team to assist policyholders affected by Hurricane Katrina.
With catastrophe specialists already in Fort Lauderdale to handle claims from the hurricane's impact on southern Florida, additional team members will move into the Florida Panhandle to serve customers as soon as the storm passes through. St. Paul Travelers has dispatched four of its five Mobile Claim Headquarters - custom-built RVs designed as mobile insurance claim offices that can provide claims services immediately following a disaster - to be stationed in Fort Lauderdale and areas of the Florida Panhandle damaged by the second landfall of the storm.
The Mobile Claim Headquarters are equipped to issue checks to policyholders on the spot, and the catastrophe adjusters use wireless technology so they can operate their laptops anywhere, which speeds the claims handling process. St. Paul Travelers also has additional claims professionals around the nation on call and ready to join this response effort.
"Our catastrophe team is expressly designed to be on the ground and highly responsive to our customers' needs in an emergency situation," said Ray Stone, vice president, Catastrophe Management for St. Paul Travelers. "With more than 300 adjusters on call and extended service planned for our Customer Care Centers, we're able to respond immediately to the damage in Hurricane Katrina's wake."
St. Paul Travelers and First Floridian claims professionals are available to take customer claims 24 hours a day, 7 days a week. Customers are encouraged to report their loss directly by calling these numbers:
-- First Floridian or Travelers Home and Auto Claims: 800.CLAIM33 (800.252.4633) -- Travelers Flood Claims: 800.356.6663 -- Travelers Boat/Yacht Claims: 800.772.4482 -- St. Paul Travelers and Travelers Business Claims: 800.238.6225 -- St. Paul Business Claims: 800.STPAUL1 (800.787.2851)
Independent agents can get updated hurricane response information on St. Paul Travelers' Agent HQ(SM) Web site.
Background on Mobile Claim Headquarters
These first-in-the-industry vehicles were developed as a result of lessons learned from Hurricane Andrew, which devastated parts of Florida in 1992. They are staffed by catastrophe response team members and equipped with everything required to process claims in the midst of a disaster, such as onboard computers and databases, printers, photocopiers, cell phones, and fax machines. Each vehicle has its own generator, so they can operate in places without electricity and can process claims through wireless or satellite connectivity if land lines are not available.
Severe Weather Tips
Stone recommends that the following measures be taken before a storm:
-- Store outdoor furniture and potted plants indoors. -- Agree with all family members on the safest place to be within the structure during the storm. A bathroom or closet in the middle of the structure is usually the safest place to stay during a storm. The room should have no windows - it is important to stay away from all glass windows. -- Store water, food, radio, flashlights, first aid kit and spare batteries in this room prior to arrival of the storm. -- For homes with well water, fill bath tubs in order to have fresh water for cooking and to flush toilets. -- Secure the structure by taking down cloth awnings and closing all windows, doors and skylights. -- If possible, videotape or make a list of all personal property inside the dwelling, which should be stored in a safe location in the event the property sustains serious damage. After the storm passes: -- Make sure all family members are safe. Listen to the radio for public service announcements. If evacuated, do not return to your home until authorized to do so. If at home, wait for the "all clear" announcement before venturing outside. -- Don't touch downed power lines; assume they are live no matter how long they have been down. -- Check for gas leaks. If you smell gas, leave immediately and call the utility company from a neighbor's house. -- Don't try to move large trees or branches that have fallen on your home, as personal injury or additional property damage could occur. -- Cover broken windows or holes in walls or roofs to prevent further damage. -- If you have damage, call your insurance carrier immediately to report your claim.


59459 8/25/2005 8/29/2005 
St. Paul Travelers Mobilizes Catastrophe Response Team following Hurricane Katrina
2005-08-29 21:14:00 UTC
HARTFORD, Conn.--(BUSINESS WIRE)--Aug. 29, 2005--St. Paul Travelers (NYSE:STA) has deployed its Catastrophe Response Team to assist policyholders affected by Hurricane Katrina in Alabama, Louisiana and Mississippi.
Catastrophe claim specialists are ready to move into the impacted areas to serve customers as soon as the storm passes through. St. Paul Travelers has dispatched five Mobile Claim Headquarters -- custom-built RVs designed as mobile insurance claim offices that can provide claim services immediately following a disaster -- to be stationed in the hardest hit areas surrounding New Orleans, Mobile, Ala., and Jackson, Miss.
The Mobile Claim Headquarters are equipped to issue checks to policyholders on the spot, and the catastrophe adjusters use wireless technology so they can operate their laptops anywhere, which speeds the claims handling process. St. Paul Travelers also has approximately 500 claim professionals around the nation on call and ready to join this response effort.
St. Paul Travelers claim professionals are available to take customer claims 24 hours a day, 7 days a week. Customers are encouraged to report their loss directly by calling these numbers:
-- Travelers Home and Auto Claims: 800.CLAIM33 (800.252.4633) -- Travelers Flood Claims: 800.356.6663 -- Travelers Boat/Yacht Claims: 800.772.4482 -- St. Paul Travelers and Travelers Business Claims: 800.238.6225 -- St. Paul Business Claims: 800.STPAUL1 (800.787.2851)
Independent agents can get updated hurricane response information on St. Paul Travelers' Agent HQ(SM) Web site.
Background on Mobile Claim Headquarters
These first-in-the-industry vehicles were developed as a result of lessons learned from Hurricane Andrew, which devastated parts of Florida in 1992. They are staffed by catastrophe response team members and equipped with everything required to process claims in the midst of a disaster, such as onboard computers and databases, printers, photocopiers, cell phones, and fax machines. Each vehicle has its own generator, so they can operate in places without electricity and can process claims through wireless or satellite connectivity if land lines are not available.
Damage Mitigation Tips
St. Paul Travelers offers the following steps to take to mitigate any damage once the storm has passed.
PROPERTY
If interior is exposed to rain and trees are down or tree debris is present, the owner should:
-- Protect their property from the possibility of any further damage. If necessary, contact a contractor to complete temporary repairs. -- If a tree or limbs are on the house, make arrangements to have the tree removed. -- Complete temporary repairs such as covering up holes in the roof with a tarp and boarding up broken windows in order to protect the home from further damage. -- If necessary, have debris cleaned up or obtain an estimate for the removal and/or clean up costs. AUTOMOBILE
Avoid driving through standing water. If the vehicle has been flooded and the water has entered the passenger compartment do not attempt to start the vehicle engine. This may cause damage to the engine or transmission.


59459 8/25/2005 9/2/2005 
St. Paul Travelers to Contribute $1 Million to Hurricane Katrina Relief Efforts; Catastrophe Response Team Deployed in Recovery Area
2005-09-02 15:08:00 UTC
SAINT PAUL, Minn.--(BUSINESS WIRE)--Sept. 2, 2005--St. Paul Travelers (NYSE:STA) has announced it will contribute a total of $1 million to the American Red Cross to fund relief efforts following the devastation caused by Hurricane Katrina. As part of its contribution, the company is facilitating direct contributions to the American Red Cross from its 30,000 employees.
"The damage and destruction left in the wake of Hurricane Katrina is heart-wrenching," said Jay Fishman, president and chief executive officer. "We have responded with a contribution to show our support, care and concern for the people and the communities in those areas. At the same time, our catastrophe claim responders are seeking out and responding to our personal and commercial policyholders."
St. Paul Travelers has deployed its Catastrophe Response Team and five Mobile Claim Headquarters to assist its customers affected by Hurricane Katrina in Alabama, Louisiana and Mississippi.
?


59459 8/25/2005 9/4/2005 
Travelers Announces Locations of Mobile Claim Headquarters in Hurricane Katrina Recovery Area
2005-09-04 21:59:00 UTC
HARTFORD, Conn.--(BUSINESS WIRE)--Sept. 4, 2005--Travelers personal lines, a member of St. Paul Travelers (NYSE:STA), has positioned its Catastrophe Response Team, including five Mobile Claim Headquarters, custom-built RVs designed as mobile insurance claim offices, in the areas hardest hit by Hurricane Katrina. These vehicles are equipped to immediately service policyholders who have experienced a loss, initiating the claim process and even issuing checks on the spot.
MOBILE CLAIM HEADQUARTERS LOCATIONS Hattiesburg, MS: Wal-Mart/Sam's Club parking lot at 6080 Hardy Street, Highway 98 West (Hattiesburg, MS 39402) Baton Rouge, LA: Home Depot parking lot at 10300 Coursey Blvd. (Baton Rouge, LA 70816) on corner of Cedarcrest Ave. Gulfport, MS: Crossroads Mall at northeast corner of intersection of I-10 and Highway 49 (Gulfport, MS 39503) Jackson, MS: Dogwood Festival Market Mall, 115 Dogwood Blvd. (Flowood, MS 39232) CLAIM REPORTING INFORMATION Travelers' claim reporting centers are prepared to take claims 24 hours a day, 7 days a week at the toll-free numbers listed below: Travelers or First Floridian Home and Auto Claims: 800.CLAIM33 (800.252.4633) Travelers Flood Claims: 800.356.6663 Travelers Boat/Yacht Claims: 800.772.4482 St. Paul Travelers and Travelers Business Claims: 800.238.6225 St. Paul Business Claims: 800.STPAUL1 (800.787.2851) 


59459 8/25/2005 9/9/2005
Item 7.01  Regulation FD Disclosure.
Property and Physical Damage Reinsurance

In light of the number of inquiries received following Hurricane Katrina, The
St. Paul Travelers Companies, Inc. (the "Company") is providing the following
additional detail regarding its property and physical damage reinsurance
program.

The Company has property and other physical damage treaties that, subject to
certain limitations and aggregate limits contained in the treaties, limit its
Commercial and Specialty loss exposure to $15 million per individual insured
property. For certain of these risks, the Company also has facultative and
other treaty reinsurance that reduces its loss exposure to less than $15
million per individual insured property.

In addition, the Company has a corporate-wide General Catastrophe Reinsurance
Treaty (the "Treaty") with nonaffiliated reinsurers to mitigate its loss
exposure resulting from a single occurrence. The Treaty covers the Company's
property and other physical damage insurance coverages, including U.S. located
insurance coverages underwritten by the Company's Lloyd's operations. For the
accumulation of such losses arising out of a single occurrence, the Treaty
covers approximately 62% of total losses between $750 million and $1 billion
and approximately 72% of total losses between $1 billion and $2 billion. The
Treaty includes a mandatory reinstatement clause that, to the extent the
Treaty is utilized, provides coverage for one additional occurrence for
further consideration. The Treaty excludes nuclear, chemical and biochemical
losses for domestic terrorism and all terrorism losses as defined by the
Terrorism Risk Insurance Act of 2002. The Treaty also excludes insurance
coverages underwritten in the United Kingdom, Republic of Ireland, and
non-U.S. located coverages underwritten by the Company's Lloyd's operations,
where separate catastrophe coverage is purchased locally and generally results
in significantly lower net loss exposure levels than in the General
Catastrophe agreement.

The Company conducts an ongoing review of its risk and catastrophe coverages
and makes changes it deems appropriate. For additional information concerning
reinsurance, see the section titled "Reinsurance" in the Company's Form 10-K
for the fiscal year ended December 31, 2004.


59459 8/25/2005 9/9/2005 
St. Paul Travelers Implements Disaster Relief Billing Plan in Hurricane Katrina Recovery Area
2005-09-09 22:10:00 UTC
HARTFORD, Conn.--(BUSINESS WIRE)--Sept. 9, 2005--St. Paul Travelers (NYSE:STA) is offering payment relief to policyholders in the impacted areas of Alabama, Louisiana and Mississippi affected by the severe flooding and damage resulting from Hurricane Katrina.
St. Paul Travelers will continue to insure customers who have been affected by the hurricane if they are temporarily unable to make their insurance payments. St. Paul Travelers has suspended sending billing-related mail to personal and commercial lines policyholders in the impacted areas of Alabama, Louisiana and Mississippi. This includes regularly scheduled premium notices, notices of cancellations for nonpayment of premium, offers to reinstate, reinstatement notices and refund checks. We have also suspended the application of non-payment cancellation notices.
Customers who need to work out temporary payment arrangements should contact their St. Paul Travelers insurance representative or independent agent. St. Paul Travelers commercial insurance customers can call 800.252.2268 for assistance, and Travelers personal lines customers can call 877.872.4708.
